text,annotation_104,annotation_101,annotation_102,annotation_103
"You were right. The station's statement: ""April Moss objected to WWJ-TV's policies regarding COVID-19 testing and wearing masks inside our station, which are based on CDC, state and local guidelines."" Also...",,masking and distancing,"masking and distancing,masking and distancing",masking and distancing
"What are the Challenges faced by you due to #CoronaPandemic...?

Small or large, any Problem faced by you... Please… https://t.co/1df8f8i6Hv",,,,
"a. The CDC does NOT say vaccinated people must go around maskless. It says they can lose their masks, with a lot of caveats. Telling people not to wear masks is not ""contravening CDC guidelines"", any more than telling people to drive more slowly at night is against traffic code",masking and distancing,"vaccination,masking and distancing",masking and distancing,"vaccination,masking and distancing"
"In June, South Africa began recruiting participants for the continent's first #covidvaccine trial. Researchers were… https://t.co/waM9ggA9sC",vaccination,vaccination,vaccination,vaccination
"And this: 5 million doses exposed to room temperature...in South Korea.

Now imagine the -80C $bntx $pfe vaccine.… https://t.co/wMNmaeXqRk",vaccination,vaccination,vaccination,vaccination
"At the end of the day Democrats want you to wear masks and get vaccinated. They've always wanted you to follow the CDC guidelines.  Republicans have fought this at every turn and are only now ""coming around"" because their precious stock market took a hit.","vaccination,masking and distancing","vaccination,masking and distancing","vaccination,masking and distancing","vaccination,masking and distancing"
Does the CDC or WHO have any guidelines on how to deal with dumbasses? That may come in handy over the next few months. #mondaythoughts,,,,
"You mean Dems that are vaccinated, following cdc guidelines for vaccinated people and not having any symptoms because they are protected.  Considering your network pushes misinformation and straight out anti vax views on some shows this is rich",vaccination,vaccination,vaccination,vaccination
"This article is a bit confusing. The headline doesn’t say for unvaccinated only but in the article it says, “All vaccinated students and teachers can go without a mask indoors, according to CDC guidelines updated today.” #GetVaxxed","vaccination,masking and distancing,lockdowns","vaccination,masking and distancing","vaccination,masking and distancing","vaccination,masking and distancing"
As if by magic... #CovidVaccine https://t.co/4MCa4zZh7r,vaccination,vaccination,vaccination,
"CDC guidelines on clean-up. Honestly, anything you can’t boil should probably be discarded — better safe than sorry. 😕   https://t.co/NVkJOEYof0",masking and distancing,,,
"possibility of re-infection does NOT render the vaccine USELESS...,(August 28, 2020; 12:45 HKT) #covidVACCINE #COVID2019 #COVID",vaccination,vaccination,vaccination,vaccination
"#Novavax said on Monday it started a mid-stage study of its experimental #COVID19 #vaccine in #SouthAfrica, as the… https://t.co/BIKN4u5mlM",vaccination,vaccination,vaccination,vaccination
"Coronavirus Vaccine Tracker.
Updated: Sep 3, 2020 

Phase 1: 24 
Phase 2: 14
Phase 3: 9
Limited: 3
Approved: 0… https://t.co/u6MPmO4K4K",,vaccination,vaccination,vaccination
"#RussianVaccine #Russia  #coronavirus #CovidVaccine
Thanks Umcle pumtin ♥️♥️ https://t.co/KPUnQlAqV0",vaccination,vaccination,vaccination,vaccination
"If you were to participate in a voluntary trial for a Covid vaccine. Which one would you trust whole heartedly and try

#CovidVaccine",vaccination,vaccination,vaccination,vaccination
"are still alive. What life you want to live?
#COVID19 #coronavirus #lockdown #CoronavirusVaccine #COVID19pt… https://t.co/iLs3r55vWv","vaccination,lockdowns","vaccination,lockdowns",,
"May his recovery be quick &amp; easy. Thank you for sharing. It is terrible MSM &amp; CDC are not reporting. The spin &amp; guidelines are causing vacc’d to feel invincible. Please make sure it is reported. Also, try to get him to move &amp; not lie on his back. Wishing your whole family healing",,vaccination,vaccination,vaccination
Are you serious? Like just read the FDA and CDC paperwork dude It's an extremely rushed stripped-down set of guidelines.  The fact of the matter is that MRNA vaccines have been attempted to pass FDA guidelines for 30 years unsuccessfully.,"vaccination,masking and distancing",vaccination,vaccination,vaccination
So how many on that plane?  That 95% effective working out?  Being vaxxed working out?  They already gave it to a member of Pelosi’s staff so it doesn’t stop the spread either. Explain how this is a vaccine and how you defend a picture of anyone violating cdc guidelines please.,"vaccination,lockdowns",vaccination,vaccination,vaccination
Oh no! What on earth will #ScottyFromMarketing do now? #auspol  #CovidVaccine #NotMyPM #ScottyFromBunnings… https://t.co/PMZAz1yW0r,vaccination,vaccination,vaccination,
"""There is quite a possibility that the American public won't accept a vaccine because of all the things that are go… https://t.co/syG0dpm8gX",vaccination,vaccination,vaccination,vaccination
"Death toll in Mexico crosses 69 thousand, reached fourth place after America, India, Brazil.
#COVID19 #CovidVaccine… https://t.co/P1S9WoBEre",vaccination,vaccination,,
#INR opened at 73.68 levels as local &amp; Asian equities are trading in red. The trials of front-runner in… https://t.co/eNocy9vZ33,,,vaccination,
Ky. Dept. of Education reviewing new CDC mask guidelines; will issue guidance to school districts  https://t.co/2UmRVuMOgv ,masking and distancing,masking and distancing,masking and distancing,masking and distancing
"It doesn't matter how many 
Resources you have 
If you don't know how to use 
Them, it will never be enough.… https://t.co/NKhh7YDXwD",,,,
"#Cruise lines likely to follow CDC rules, no matter court decision (Cruise lines will continue to exceed CDC guidelines and recommendations! Who is this mysterious ""expert?"") fr  https://t.co/9H9j2vqtMX",masking and distancing,,,
"Not murky when they log the data…  State data, cdc guidelines and #4 in the nation in deaths per capita, top 15 globally when comparing states to countries.  https://t.co/9cT9lPZYXi",,,,
"Noah Brown: ""Experimental Research for COVID-19 Treatment gets Boost from 4,000 Shincheonji Church Members"" (Zambia… https://t.co/yT9LbZnvGx",vaccination,,,
"The biggest flaw in CDC guidelines are based on people being honest about whether or not they're vaccinated, people being smart and wearing masks if they're not and at minimum requires people have a brain.",masking and distancing,"vaccination,masking and distancing","vaccination,masking and distancing","vaccination,masking and distancing"
The civic-run King Edward Memorial (KEM) Hospital in #Mumbai began phase II and III trials of the Oxford Covishield… https://t.co/67ntLgYrkD,vaccination,vaccination,vaccination,vaccination
Interesting listen over my wfh coffee #covidvaccine https://t.co/rkA5Qqrneh,vaccination,,vaccination,
"The thing that also kills me is: when or if a #CovidVaccine comes to be, the anti-vaxxers… https://t.co/9hI9EdvD1J",vaccination,vaccination,vaccination,vaccination
This is why Vaxart has the answer with their covid pill vaccine #Warpspeed #vaxart #CovidVaccine,vaccination,vaccination,vaccination,vaccination
"Only mad when the CDC guidelines are not followed by state, county or city agencies for political reasons and not the same science from ",masking and distancing,,,
This Russian #CovidVaccine is 100% going to turn into the plot of ‘I am Legend’ 🤷🏼‍♂️. https://t.co/FukRiEufAb,vaccination,vaccination,vaccination,vaccination
"Which part of👇is so hard to understand, Many of us are boycotting flying until you lift the mask mandates. You don’t wait for CDC to set guidelines for your flight route, why are you allowing them to dictate to you. CDC has lost its credibility!","masking and distancing,lockdowns",masking and distancing,masking and distancing,masking and distancing
"Vaccinated teachers and students don't need to wear masks inside school buildings, the CDC said Friday. Read the new guidelines here.  https://t.co/ihiyOBzx60","vaccination,masking and distancing,lockdowns","vaccination,masking and distancing",masking and distancing,vaccination
"Moderna Vaccine won't be Ready before Election-- a Big Setback to President Trump 
#Moderna #Modernavaccine… https://t.co/Bokw8uaA1y",vaccination,vaccination,vaccination,vaccination
Is it really a shocker that I'm disappointed in yet again? The CDC guidelines still say unvaccinated people should wear masks and it's no longer required for any staff members per an email sent out today.,masking and distancing,"vaccination,masking and distancing","vaccination,masking and distancing","vaccination,masking and distancing"
"#CDCGuidelines ignore science, contradict their own collected data: 99.97% of youth under 18 survive Covid without vaccines or masks. #FollowTheScience or turn in your credentials!!! Forcing kids to vax or mask is #ChildAbuse of the worst kind! Shame, shame, shame!","vaccination,masking and distancing","vaccination,masking and distancing","vaccination,masking and distancing","vaccination,masking and distancing"
"This... major concern here in the Midwest. We have guidelines. We have the CDC, American Academy of Pediatrics statements. This is not over for parents of young kids. Just because some facilities don’t abide by evidence-based recommendations does not mean it’s okay.",masking and distancing,,,
"We MUST start putting the pieces together! The CDC is NOT ""revising/expanding"" their ""Guidelines"" because of public outcry &amp; the mass suffering &amp; avoidable deaths that have predictably resulted. They are doing it because it's PART OF THE #NationalPainStrategy Agenda!",masking and distancing,,,
"The virus is here to stay for at least an year, extending it by 21 days would not have any positive eff… https://t.co/flLnT94XUJ","masking and distancing,lockdowns",,,
"A mystery illness suffered by a participant has put the largest COVID-19 vaccine trial on hold, drug maker Johnson… https://t.co/eCTUNQtQU9",vaccination,vaccination,vaccination,vaccination
"We Laughed At Ganesh Gaitonde's Dialogue
""Sab Marr Jaayenge Bas Trivedi Bachega""

But Now It Seems Like ""Trivedi"" M… https://t.co/riyhhkkeFA",,,vaccination,
"*CDC Guidelines=Unscientific *CDC have NO business establishing “Guidelines, Rules or Law regarding Prescription of OpiatePainMeds. *The CDC “opioid crisis” DOSE LIMITS PainMeds. *DEA Overreach-REDUCED SUPPLY by 53% 💉Fentanil OD DEATH Crisis #RemoveCDCguidelines  #DefundTheDEA",masking and distancing,,,
Never said that. Never said unvaxxed should be masked. Never said people should lose rights. Pointing out the contradiction to CDC guidelines they’ve lectured about following for the last year +. People should make choices right for them. Chill&amp;stop putting words in my mouth,"vaccination,masking and distancing","vaccination,masking and distancing",masking and distancing,"vaccination,masking and distancing"
"..acknowledge the 100’s or maybe 1,000’s of CPP’s who by now have committed #SuicideDueToPain because of the CDC Guidelines &amp; DEA crackdown on anyone taking or being prescribed Opioids. Erin posted these messages days ago  &amp; then took her own life because she couldn’t deal 2/3",,,,
"CDC updates mask guidelines for K-12 schools, strongly recommends vaccination for children  https://t.co/kbL3laddTN",masking and distancing,"vaccination,masking and distancing","vaccination,masking and distancing","vaccination,masking and distancing"
Trudeau Confirms That Approved COVID-19 Vaccine Will Be Free for All Canadians #Covid19UK #CovidVaccine… https://t.co/IIyDRt29hP,vaccination,vaccination,vaccination,vaccination
We are carefully following all CDC guidelines in order to keep you and your loved ones safe while also caring for your teeth.  #barnumdental #dentist #oralhealth #teeth #smile #stratford #stratfordct  https://t.co/E1XaUKFVgy,masking and distancing,,,
"With all the information Dr. Fauci has given us, with all we know abt Putin, it’s enough to be sure they have NOTHI… https://t.co/sMYkyUDEO8",,,vaccination,
"The reason it hasn't ""lived up to expectations"" is because of the number of people here who took the warnings seriously and followed the CDC guidelines.  I'm pretty sure the people of India don't think it's a joke.",masking and distancing,,,
