text,annotation_104,annotation_101,annotation_102,annotation_103
"#COVID19
Could #CovidVaccine be okay..? https://t.co/VrUXpVS6FY",vaccination,vaccination,vaccination,vaccination
Ikr i can't wait to hear that crowd again but i hope they still follow the CDC guidelines,lockdowns,,,
so you would be okay with drunk drivers as long as they don’t speed?,,,,
"We're presenting the 2021 Community Health Institute (CHI) and Expo as a hybrid event, August 22-24, in Orlando, FL. You may join in person, abiding by CDC guidelines for safety, or virtually from your home/office. Registration is open!  https://t.co/S9ItFUEmKI #NACHCEvents  https://t.co/epoazeJYp4",,,,
"After reviewing new COVID-19 guidelines, consistent with Center for Disease Control (CDC), CalOSHA guidance, as well as the Governor's r ...  https://t.co/KmtKqqXG7e",masking and distancing,,,
How are we told to follow the CDC when we don't even know who those ppl are .. they background.. thet experience.. we don't know these ppl .. but yall telling us to follow they guidelines ?🤔,masking and distancing,,,
"Breaking News : #Russia released world's first #CovidVaccine.😊😊

#Putin said ""Russian health ministry has approved… https://t.co/J9hEiUdslN",vaccination,vaccination,vaccination,vaccination
THREAT TO HUMANITY” WHY CDC UNSCIENTIFIC OPIOID PRESCRIBING GUIDELINES CANNOT BE REFORMED    https://t.co/S5VdNDNLJC,masking and distancing,,,
World Health Organization Director-General Ghebreyesus on Tuesday called on countries to share their supp… https://t.co/gbzBi5K0AB,,,vaccination,
Stop torturing pain patients with false data &amp; propaganda on #opiod prescriptions being responsible for OD. They are not. The #DEA draconian methods #CDC put out false data &amp; guidelines that were used to ensure the suffering of Million. Nobody is listening/ helping those in pain.,,,,
READ AND LISTEN TO  https://t.co/UFRmYf1NsL #MAKETHISGOVIRAL STUDIES SHOW MORPHINE MILLIGRAM EQUIVALENT (MME) USED IN CDC 2016 OPIOID GUIDELINES ARE BOTH BOGUS AND UNSCIENTIFIC: THEY MUST BE REPUDIATED AND WITHDRAWN  1.  https://t.co/EmEj17ze19,masking and distancing,,,
"People who are fully vaccinated can travel within the U.S., according to updated CDC guidelines announced on Friday.  https://t.co/gcSa5MhcS2","vaccination,lockdowns",vaccination,vaccination,vaccination
"The simple fact is that irrespective of CDC guidelines the same people who refuse masks, refuse vaccines. Conversely, responsible people dont need mandates. They do whats right. The CDC cant be blamed for Delta. The GOP governors ignored it anyway.","vaccination,masking and distancing","vaccination,masking and distancing","vaccination,masking and distancing","vaccination,masking and distancing"
Not enough room in classrooms to social distance.  The cdc knows this.  Their guidelines suck.  They need to reduce them,"masking and distancing,lockdowns",masking and distancing,masking and distancing,masking and distancing
"Russia developed 1st Corona Vaccine in the world. It's approved and registered by Russian Government. 

President V… https://t.co/ZHQm76wQta",vaccination,vaccination,vaccination,vaccination
Russia's deputy Prime Minister Tatiana Golikova on Wednesday said that the country is preparing to approve a second… https://t.co/YAf0xehpgZ,,vaccination,vaccination,
The face mask guidelines from the American Academy of Pediatrics differ from updated school recommendations the CDC announced recently.  https://t.co/jr6zJaJTqF,"masking and distancing,lockdowns",masking and distancing,masking and distancing,masking and distancing
"Many fully vaccinated have gotten COVD but will not die. The ones not vaccinated - their odds are not good. So your point is? Private planes do not require masks &amp;CDC guidelines say groups fully vaccinated when together do not have to wear masks. In DC, they have worn masks.","vaccination,masking and distancing","vaccination,masking and distancing","vaccination,masking and distancing","vaccination,masking and distancing"
Enforcing a laws passed by Congress isn't the same as an EO and CDC guidelines that have no requirements to be met.,masking and distancing,,,
When #Russia announced its development of #CovidVaccine I saw many Ethio tweeps with fireworks &amp; balloon/champagne… https://t.co/8wds8fYWSs,vaccination,vaccination,vaccination,vaccination
"So Russia finally ""Put-in"" some great effort and get us a sputnik-V after successful clinical trails. Great job.
👏… https://t.co/Z67k9icB6C",vaccination,,,vaccination
"June 30, 2021 GOP Congressman Chip Roy. Where were you when this happened? Ted Cruz massless on federal property before CDC guidelines changed.  https://t.co/mNx2rR6QqQ",masking and distancing,,masking and distancing,
Even kids are eager to get the injection.#CovidVaccine #coronavirus,vaccination,vaccination,vaccination,vaccination
Airlines were planning to lifting mask mandates on planes in Sept. I can see the writing on the wall if CDC starts issuing mask guidelines for the new “variant”,masking and distancing,masking and distancing,masking and distancing,masking and distancing
The Covid-19 vaccine candidate developed by Oxford University in partnership with UK-based global biopharmaceutical… https://t.co/gOwWkJkir3,vaccination,vaccination,vaccination,vaccination
"California goes rogue, ignoring science and CDC’s COVID-19 guidelines.   https://t.co/fSKpetBGwG",masking and distancing,,,
"I don't know, I just listen to what our version of the CDC says and follow their guidelines. Here they say it's over pretty soon. Norway, Finland, Denmark and others are lifting restriction","masking and distancing,lockdowns",lockdowns,,lockdowns
Serum Institute of India CEO Mr poonwala said it will take another 4-5 years to make vaccine available for each and… https://t.co/vcvpvDkZHr,vaccination,vaccination,vaccination,vaccination
".is looking to raise up to $1 billion (around Rs 7,500 crore) for Covid-19 vaccine development. Det… https://t.co/LTXSkBcI90",vaccination,vaccination,vaccination,vaccination
"The discussion for SMAC is now about whether masks should be required inside. Most members recommend following CDC guidelines, which call for masks for the unvaccinated. It was pointed out that students still have to wear masks inside schools until July 13. #delhs",lockdowns,"vaccination,masking and distancing","vaccination,masking and distancing","vaccination,masking and distancing"
Perhaps he need to contact Russia their vaccine is up and running ... Sputnik 1 what could go wrong 😳#CovidVaccine… https://t.co/7B2HG2Py9r,vaccination,vaccination,vaccination,vaccination
"India Corona Vaccine Latest Update: Read here

#coronavirus #CoronavirusVaccine #CovidVaccine 

https://t.co/zQ97vnqb7e",vaccination,vaccination,vaccination,vaccination
Great to hear the covid vaccine is working. Thank you Russia hope this vaccine won't see caste creed color &amp; standa… https://t.co/EaBGw5QkMq,vaccination,vaccination,vaccination,vaccination
If the 25m why 85m doses?! Surely that’s no less amoral than hoarding toilet paper. #vaccine #TheNewNormal… https://t.co/l3L9aJhr6m,vaccination,vaccination,vaccination,
Exclusive: Fauci says rushing out a #CovidVaccine could jeopardize testing of others https://t.co/00hF6EPhy7,vaccination,vaccination,vaccination,vaccination
Delta: WHO urges fully vaccinated people to continue to wear masks as variant spreads   This is contrary to CDC mask 😷 guidelines. Thoughts? #medtwitter #cardiotwitter   https://t.co/ID2gFzAHcw,"vaccination,masking and distancing","vaccination,masking and distancing",vaccination,"vaccination,masking and distancing"
"A) #COVID: 90% survival rate
#covidvaccine: 1)There isn’t any vaccine that finished the Treatment Phase3
2) will be… https://t.co/lDvcehbGZG",vaccination,vaccination,vaccination,vaccination
"No sorry , you may want to check the cdc official guidelines.",masking and distancing,,,
"#Breaking
#CovidVaccine
#russiavaccine
Russia has developed 'first' coronavirus vaccine: Putin

MOSCOW: Russia has… https://t.co/BXk46QMFJV",vaccination,vaccination,vaccination,vaccination
"Ight bruh just cuz the CDC relaxeD their guidelines doesn’t mean you can be ALL UP ON ME IN LINE , BACK THE FUCK UP. They got stickers on the floor for a REASON",masking and distancing,,,masking and distancing
"$HTBX my thoughts is Tcell standalone vaccine or booster for others, this needs more attention… https://t.co/vstz1SQwF9",vaccination,vaccination,,
I did for about a month after the CDC guidelines changes and then I stopped,masking and distancing,,,
also reminds us that when someone says they would want a #COVIDvaccine to remind them to get a #FluShot and… https://t.co/Jvmb8AI7f6,vaccination,vaccination,vaccination,vaccination
#webnews21 #ExaBFF #ExaBLINK #ExaAMRY #CovidVaccine #COVID #CoronaVirusUpdates #covidfreeworld #Bitcoin #usa… https://t.co/WBRjKW9gov,vaccination,vaccination,,
Cdc guidelines sucked. They let unvaccinated use honor system. Didn’t work,masking and distancing,vaccination,vaccination,vaccination
"Just memes,no data?We all went to work outside of the home. Kids went to school, in person. We just followed CDC guidelines. We had 0colds, 0flus, 0tummy bugs. My family has never been so healthy. Wearing masks prevent the spread of many infections, not just Covid.  UR selfish","masking and distancing,lockdowns","masking and distancing,lockdowns",masking and distancing,"masking and distancing,lockdowns"
The California National Primate Research Center is in the news. Via #COVID19 #CovidVaccine https://t.co/HNin7U7TX8,vaccination,vaccination,vaccination,
Participants who received #CovidVaccine AZD1222 in phase I/II trial had developed detectable neutralising antibodie… https://t.co/rgY8rc0Gi7,vaccination,vaccination,vaccination,vaccination
📷 Currently our only hope! Late post #inktober2020 #prompt “ #hope ”. #covidvaccine #covid_19 #doodlerbasically… https://t.co/u3jJ9FuDOw,vaccination,vaccination,masking and distancing,
will not be enforcing the rules because they contradict CDC guidelines  https://t.co/hclKANhbQj via ,masking and distancing,,masking and distancing,
"Why do they say that? The CDC guidelines said if a person dies w/in 30 days of having COVID it is marked as a COVID death regardless.   If I kill myself 10 days after a positive COVID test, I died of COVID not suicide. That's an overcount",,,,
"Agreed.  Also needs to revise guidelines on masks.  Masks should be for all. Vaccinated and unvaccinated.  Especially indoors, for all events and/or offices and schools.","vaccination,masking and distancing,masking and distancing","vaccination,masking and distancing",,"vaccination,masking and distancing"
"Corona Update in India!
Total Confirmed:2.72M
Active Cases:0.67M
Total Recovered: 2M
Total Deaths:52163
Updated at:… https://t.co/WTJDYzWQsu",,,,
"CDC leaving it up to states to set guidelines for masks, director says  https://t.co/kyTHOTGMlj",masking and distancing,masking and distancing,masking and distancing,masking and distancing
"Notice the glaring omission of any mention of the NIH since the are neutral on IVM in C19. Which BTW, the NIH is the only US federal health agency responsible for creating treat guidelines.  Not the FDA or CDC!",masking and distancing,,,
#CovidVaccine  Reconstruction  of a Mass Hysteria: The Swine Flu Panic of 2009 https://t.co/3hltOyKQXD via ,vaccination,vaccination,,
Craig Bill Would Ensure Fair Distribution of COVID-19 Vaccine https://t.co/gqEWHQi3kz,vaccination,vaccination,vaccination,vaccination
CDC takes a 'sharp departure' in latest guidelines for schools:  https://t.co/EiidPwm1zh,lockdowns,,masking and distancing,
I have been saying for a quite awhile now that we should be allowed to have access to all Congress &amp; govt officials their medical records to see what medications they are prescribed &amp; what they are taking it for &amp; are they are following the cdc guidelines…,masking and distancing,,vaccination,
"It's actually even worse than that, CDC's offcial guidelines for PCR testing of fully vaccinated people say that maximum of 28 cycles is to be used, while the standard for u vaccinated people seems to remain between 37-40 cycles. That's a huge difference 🤬","vaccination,masking and distancing",vaccination,vaccination,vaccination
“The CDC’s relaxed guidelines on masking are meant to reassure vaccinated people that they are safe from serious illness. And they are. But the picture is less clear-cut for the unvaccinated who interact with them.”,"vaccination,masking and distancing","vaccination,masking and distancing","vaccination,masking and distancing","vaccination,masking and distancing"
CDC director weighs in on mask guidelines as virus variant spreads  https://t.co/eNN3AoppgV  https://t.co/PGxkyHW9HW,masking and distancing,masking and distancing,masking and distancing,masking and distancing
"THIS is why it’s key that we don’t rush, and we certainly shouldn’t think that a vaccine by Election Day is remotel… https://t.co/iGVNzxfMyw",vaccination,vaccination,vaccination,vaccination
"Trump used a marketing approach to the pandemic. He was a terrible communicator. I still don’t know his opinion on mask - “follow the CDC guidelines”, but he didn’t wear one. 🤦🏽‍♂️",masking and distancing,masking and distancing,masking and distancing,masking and distancing
"“Dr. Anthony S. Fauci, director of the National Institute of Allergy and Infectious Diseases, which is overseeing t… https://t.co/ioUkZ7R4Tp",,,vaccination,
"I’d like to add that all those covid cases could have definitely been avoided if the mass population followed all the cdc guidelines, cancer is not something you catch just by going to the grocery store","masking and distancing,lockdowns",,,
This is someone who clearly did not follow CDC guidelines or perhaps he followed the wrong CDC guideline,masking and distancing,,,
From August 18: #RobertLitan of  wants USGOV to pay each person $1000 to sell away their human genom… https://t.co/UaluptBQ7j,,,,
"We all want news about COVID treatments. On October 22nd, Mike Sullivan, CEO of will be sharing the l… https://t.co/BZjJDMVZCS",,,vaccination,
"Join the UF Center for European Studies for the free film series, ""Cinema on Tap"" at Cypress &amp; Grove. We are featuring the Hitchcock classic, To Catch a Thief. Grab your favorite person, your favorite local brew, and enjoy this suspenseful film! CDC guidelines will be followed.  https://t.co/Fclq81lzXi",,,,
"#CoronavirusVaccine #CovidVaccine 

Putin to Everyone rn : https://t.co/NiVqoenzgD",vaccination,vaccination,vaccination,
"""Well, I read that per CDC guidelines, masks are optional, so..""..",masking and distancing,masking and distancing,masking and distancing,masking and distancing
"Be part of the change! 🌎

Research Centers of America is looking for adult participants interested in being part of… https://t.co/S8sKR3eUhF",,,vaccination,
"People are talking about the economy of India and giving their views on it, with no analytical knowledge . It’s lik… https://t.co/NcXEV04ble",,,,
It's about time the CDC established guidelines for areas in the pool to be designated for those with diarrhea...,,,lockdowns,lockdowns
View VYF's comments to on their discussion draft of the Preliminary Framework for Equitable Allocation of… https://t.co/Gc0T9u8ITg,,,vaccination,
"BJP is openly offering #CovidVaccine in exchange of vote in #BiharElections2020 . #ElectionCommission should clear,… https://t.co/ECHBLo6yzt",vaccination,vaccination,,vaccination
"guidance must establish a process for vetting a #COVIDVaccine that is evidence-based, independent &amp; transpa… https://t.co/Br6sNCLuuU",vaccination,vaccination,vaccination,vaccination
"HOT topic...,continued (August 22, 2020; 10:18 HKT) #covidVACCINE #covidVACCINE",vaccination,vaccination,,
"""The 1986 decision by the U.S. Congress to grant total legal immunity to #vaccine manufacturers has resulted in dec… https://t.co/WI2neVbugM",vaccination,vaccination,vaccination,vaccination
"Great news for ⁦ and #globalhealth , but we will need to also focus on HOW we will deliver this #CovidVaccine!… https://t.co/jRyz1IpFHR",vaccination,vaccination,vaccination,vaccination
More than 225 Mumbaikars have volunteered to take part in the Phase II and III trials of #Covidshield – the potenti… https://t.co/K9KkXko45L,vaccination,vaccination,vaccination,vaccination
We are carefully following all CDC guidelines in order to keep you and your loved ones safe while also caring for your teeth.  #anthemaz #anthemsmile #dentist #oralhealth #dentalpractice #smile  https://t.co/hRig85D7RG,masking and distancing,,,
California virtue signaling and not following the science... I love it.  Los Angeles Times: California to require masks in schools despite CDC guidelines.  https://t.co/4CXCFBaDbp,masking and distancing,masking and distancing,masking and distancing,masking and distancing
4)..It now appears that the #CDC is back-tracking on its guidelines that vaccinated people do not have to wear masks. 'Vaccines may not protect those who are' immunocompromised'. Such a broad term could very well mean that everyone who was fully vaccinated needs to wear a mask..,"vaccination,masking and distancing","vaccination,masking and distancing",masking and distancing,"vaccination,masking and distancing"
"India’s #COVIDー19 vaccine may be available by end of 2020: Union Health Minister Dr. Harsh Vardhan on August 22, as… https://t.co/bSaKvuiRFo",vaccination,vaccination,vaccination,vaccination
"https://t.co/DX4dzpAGAo

Are you going to get Vaccine for corona for this year 2020🤨🧐😕😟… https://t.co/neR4EILXe2",vaccination,vaccination,vaccination,vaccination
"The first Battery 37 watch party of the 2021 season is almost here! Join us in Westfield for our first get-together in a looong time.   🆚 📆 Wednesday, July 7 🕢 7:30 PM ET 📍- Westfield ⚠️ If you are not vaccinated, please wear a mask per CDC guidelines.  https://t.co/JytEv5o9Me",masking and distancing,"vaccination,masking and distancing,lockdowns",masking and distancing,"vaccination,masking and distancing"
New CDC guidelines:   1. Fully vaccinated people do not need to worry about masking up or physically distancing in any setting.  2. Fully vaccinated people do not have to quarantine or test after a known COVID-19 exposure.   #CDC #Covid #CoronaVirus #HealthCare #Masks #Mask  https://t.co/InoBUwCi0F,"vaccination,masking and distancing,lockdowns","vaccination,masking and distancing",masking and distancing,"vaccination,masking and distancing"
"I don’t think now is a good time to get arrested for lewd conduct. Jail consists of a cell, and the room that they shoehorn you in doesn’t not accommodate for CDC guidelines.",masking and distancing,,,
"What kills me is I don't think they even believe what they paid ABT Marketing and PRR to deliver the 2016 CDC Guidelines nonsense! And these, ""Opioid pain medicines are bad"" policies are being picked up in several other countries! A previous statement from CDC said meds were good",,,,
Wearing a mask indoors doesn't protect vaccinated people from unvaccinated people who aren't wearing masks. If the CDC wants masks they need to change their guidelines so everyone is required to wear them indoors again.,"vaccination,masking and distancing","vaccination,masking and distancing","vaccination,masking and distancing","vaccination,masking and distancing"
We have to do a better job in education Americans! CDC should be mailing out to every address what you need to know and set up a hotline since states have not followed the guidelines. Old school but it works!,masking and distancing,,,
"California Will Keep Masking, Testing In Schools Despite CDC Guidelines That Vaccinated Teachers, Students Don't Need Masks  https://t.co/3hf8T7fm7t",masking and distancing,"vaccination,masking and distancing",masking and distancing,"vaccination,masking and distancing"
You clearly don’t watch the news. Tucker Carlson is not the news.  There are no CDC guidelines preventing people from gathering with family and friends. You don’t have to live in denial of COVID to make memories.,masking and distancing,lockdowns,masking and distancing,
"may reach the efficacy datapoint this month, but wants to have two months of safety data post 2nd injection… https://t.co/hg5NUlCQYm",vaccination,vaccination,vaccination,
"The CDC guidelines state a vaccinated person can be maskless. But, you are not allowed to ask their vaccination status. Catch-22...🤷‍♀️","vaccination,masking and distancing","vaccination,masking and distancing","vaccination,masking and distancing","vaccination,masking and distancing"
My favorite is when they put the disclaimer at the bottom saying that the commercial was filmed prior to the planned-demic or that CDC guidelines were practiced during filming. WHO CARES?,masking and distancing,,,
"They went. Their choice. Article doesn't indicate anything other than a number.  99.5% or better survival rate for healthy adults or so CDC says.  If they did/didn't follow guidelines, they can't blame anyone but themselves.",masking and distancing,,,
"No guarantee the will listen to science or reason, but still a relief so many are starting to come forward to say their guidelines are bad.",,,,
Federal judge sides with Florida in lawsuit with CDC over cruise ship guidelines  https://t.co/CTFo4Mx37B  https://t.co/v4i8nh841s,"masking and distancing,lockdowns",,vaccination,
Our open enemies as Black people will never have our best interest in mind. Also not all 'skinfolk' is 'kinfolk'. S… https://t.co/0LZ5YMIs3V,,,,
"Are you looking for a Logo Design for your brand?
You are in the right place, our Designart99 Team would love to wo… https://t.co/AT3mu85MJL",,,,
"Bharat Biotech is doing a great work..
#BharatBiotech 
#CovidVaccine https://t.co/CGvCBJUVkr",vaccination,vaccination,vaccination,
"Do you think india should order covid19 vaccine made by Russia as soon as possible ?
#RussianVaccine 
#CovidVaccine… https://t.co/rfGMCl2Emo",vaccination,vaccination,vaccination,vaccination
CDC issues school mask guidelines. What it means for Bay Area schools  https://t.co/XGDCrYrNbU,masking and distancing,masking and distancing,masking and distancing,masking and distancing
"#COVIDVaccine 
I for one will NOT take a rushed g… https://t.co/Jj06BNe94Z",vaccination,vaccination,vaccination,
$MRNA 🇺🇸 #Moderna stock rally fades as analysts weigh in on what U.S. government supply deal means for COVID-19 vac… https://t.co/hoxlGWm9Wa,vaccination,vaccination,,vaccination
"Breaking news : Nepal announces first Covid 19 vaccination.

#RussianVaccine
#CovidVaccine",vaccination,vaccination,vaccination,vaccination
"This is pathetic!

A supposed labor-leader defending #BigPharma?

The 4 major vaccine manufactures are… https://t.co/392aLdTueD",vaccination,vaccination,vaccination,vaccination
Health officials worry nation not ready for COVID-19 vaccine https://t.co/UUkxjRiXZ9 #COVIDVaccine #USHealth,vaccination,vaccination,vaccination,vaccination
I wait #whatiwantedtosay #COVID19 #COVID19Aus #russia #CovidVaccine https://t.co/coHK5eOpkj,vaccination,vaccination,vaccination,
"CDC's job: To provide trends on ""expensive and dangerous"" health threats.  FDA's job: To provide info about the nation's food and drug supply.  So why is the CDC publishing guidelines about prescribing drugs when it's FDA's expertise?  👇",masking and distancing,,,
"Vaccinated teachers and students don’t need to wear masks inside school buildings, the CDC said Friday in relaxing its COVID-19 guidelines.   https://t.co/eZ28gh0bus",masking and distancing,"vaccination,masking and distancing,lockdowns","vaccination,masking and distancing","vaccination,masking and distancing"
"Oxford, AstraZeneca Halt COVID-19 Vaccine Trial After Stage 3 Testing Volunteer Falls Sick

#oxfordvaccine… https://t.co/K0LikEK3Kl",,vaccination,"vaccination,vaccination",vaccination
"I've never seen someone squirm this much... 
#billgates #BillGatesBioTerrorist #covidvaccine #covid",vaccination,vaccination,,
Wow it's about time there is some sort of PSA warning the public about illegal fentanyl smuggled into the US! Pain patients have been screaming this since the 2016 CDC Guidelines So far it's been crickets from instead CDC counted illegal fentanyl as a legal TX,masking and distancing,,,
Important the link is here #CovidVaccine 👉 https://t.co/EboReP8Rh7 https://t.co/iuj6Lw437u,vaccination,vaccination,,
"Glad to see more spotlights starting to shine on the questionable policies and guidelines of the CDC. Here’s another good article detailing the possible miscues, or outright errors.",masking and distancing,,,
"India's hunt for #Covid19 vaccine. Take a look at this report. ((
#Coronavirus… https://t.co/vFQWeS9Kiy",vaccination,vaccination,vaccination,vaccination
"Guidelines for Covid-19:  Please practice social distancing - Do not share food and drinks If you are experiencing the following symptom - extreme difficult breathing,  please call 911 right away  You can do a million different things at home to stay sane: blob  and  think.","masking and distancing,lockdowns",masking and distancing,masking and distancing,masking and distancing
"Russia has developed a vaccine!

My Prediction: WHO will soon come with a study that will prove the vaccine does no… https://t.co/KlQKjfml42",vaccination,vaccination,vaccination,vaccination
"going in to (some) stores that post CDC guidelines ‘no masks for vaxxed ppl’. This non-lethal virus got my attention, though! I’m sure I picked it up going thru those low-vaxxed states. It wasn’t COVID THIS time. And the vaccine, which I am totally grateful for, 3/","vaccination,masking and distancing","vaccination,masking and distancing","vaccination,masking and distancing","vaccination,masking and distancing"
