text,annotation_104,annotation_101,annotation_102,annotation_103
Putin After Announcing #CovidVaccine #Russian https://t.co/rNDFFcaHNd,vaccination,vaccination,vaccination,
Courtesy: WA! #WhatsApp #COVID #CovidVaccine https://t.co/zQNeLva9GJ,vaccination,vaccination,,
4 of the vaccines Jared bought are expected to fail and Trump refuses to join the global… https://t.co/nBO2o0PNok,vaccination,vaccination,vaccination,vaccination
One day you will realize CDC Guidelines magically aligned with Teachers Unions demands,masking and distancing,,,
Im far from lying.  Current CDC guidelines is wearing a mask indoors and if you aren’t vaccinated. Is that wrong?,masking and distancing,"vaccination,masking and distancing",vaccination,"vaccination,masking and distancing"
"Russia’s Covid vaccine ‘Sputnik-V’ might be released for civilian use this week, says report #CovidVaccine
#SputnikV
https://t.co/je1m0MrQOe",vaccination,vaccination,vaccination,vaccination
"I don’t see masks. In fact, my child was there…and we respected her decision not to wear a mask according to CDC guidelines. We also respected the decision of others if they chose to wear one. It’s that simple. That’s what we should instill in our children. Choice.",masking and distancing,masking and distancing,masking and distancing,masking and distancing
"I am fully vaccinated, unless CDC guidelines change, I don't wear a mask.","vaccination,masking and distancing","vaccination,masking and distancing","vaccination,masking and distancing","vaccination,masking and distancing"
we ask every single person that walks in so we know if they need to wear a mask per CA and CDC guidelines. if they aren't willing to confirm/deny vaccination they are asked to leave. this isn't hard. only in American can a life-saving vaccine be made political. congrats GQP,"vaccination,masking and distancing","vaccination,masking and distancing",,"vaccination,masking and distancing"
will the sense touch 40k after a #CovidVaccine is released for unregulated sale in India?,vaccination,vaccination,vaccination,vaccination
"Health ministry approval Covid vaccine in Russia
#CovidVaccine https://t.co/cc1ha1cYCr",vaccination,vaccination,vaccination,vaccination
10 Days of Onam names | in kerala https://t.co/A2nX9r7OkB via #onam #kerala #VinayagarChathurthi2020… https://t.co/3W4UjMXeng,,,,
"amazing review and insights from #vaccine experts I highly recommend! 
*cold storage
 *safety issues… https://t.co/Mr4OTUlhga",vaccination,vaccination,vaccination,
Pretty sure the only people wearing masks right now are the vaccinated people.  The antivaxx people are also anti mask.  The CDC did a terrible job with their new mask guidelines.,"vaccination,masking and distancing","vaccination,masking and distancing","vaccination,masking and distancing","vaccination,masking and distancing"
These patients are slowly being tortured and then fully tortured when all off the meds. I feel for all the CPP pts may God give them relief soon. The cdc guidelines are changing within a.year. it will be better for cpp.,masking and distancing,,,
Safety &amp; efficacy of #CovidVaccine must follow science protocols - NOT political pressure. https://t.co/IQ0bDZ6ZU5,vaccination,vaccination,vaccination,vaccination
unveils online platform to ease #CovidVaccine #supplychain challenges - #COVID19 #pandemic #logistics #Cargo… https://t.co/mVHWKQZ7Nm,vaccination,vaccination,vaccination,vaccination
One reason the CDC mask guidelines are so reprehensible.,masking and distancing,masking and distancing,masking and distancing,masking and distancing
"I love how all he’s saying is that “I don’t believe in the science of vaccines, the CDC guidelines, or the rest of the country that is aligned with the cdc”",masking and distancing,vaccination,vaccination,vaccination
Russia becomes first country to register a coronavirus vaccine. #Russia #Putin #coronavirus #CovidVaccineRace… https://t.co/T1gouBKnnp,vaccination,vaccination,vaccination,vaccination
China’s Sinovac Biotech plans to start a clinical trial of its experimental vaccine against the coronavirus disease… https://t.co/lblV2b6ep6,vaccination,vaccination,vaccination,vaccination
That's what the mayor says but the city still isn't following guidelines. ADH Dr. Dillaha's instruction to mask if vaccinated is not being followed by city employees. It is in the CDC guidance for areas of high transmission too.,masking and distancing,"vaccination,masking and distancing","vaccination,masking and distancing","vaccination,masking and distancing"
I follow CDC guidelines and am fully vaccinated and I'm not a maga nut job but we have to start living again. If you are afraid stay home bc businesses need to resume and get back to normal life.,"vaccination,masking and distancing,lockdowns","vaccination,lockdowns",vaccination,vaccination
Hey care to explain why your board voted tonight to go against the CDC guidelines tonight?  What changed?,masking and distancing,,,
"Watchout, today #newzealand has an outbreak of five matching the US total on the last 10 seconds.… https://t.co/NZySaC4VOI",,,,
After getting COVID-19 and waiting 3 months (per CDC guidelines)…  I finally got my 1st dose of the vaccine! 💉🥰 #VAXXED  https://t.co/C9HmHApwoI,vaccination,vaccination,vaccination,vaccination
"Must read summary of #CovidVaccine development. Major conclusion:
Vaccine research for COVID-19 started before we e… https://t.co/BDtl0DpGzM",vaccination,vaccination,vaccination,vaccination
"CREWNY's top priority remains the health and safety of our members. We ask that you comply with all COVID-19 safety guidelines established by the CDC &amp; NYC health authorities, including wearing a mask and maintaining safe distancing, to ensure a safe and welcoming environment.","masking and distancing,lockdowns",masking and distancing,masking and distancing,masking and distancing
"Experience 4, Medicaid (ACA) fights to not pay for pain medication (in accordance with CDC's 2016 Guidelines on opioid's.   Experience 5, pharmacies look at you as if your an addict. CVS pharmacist said ""he couldn't fill prescription, he takes aspirin and is fine- popped 2 fake",,,,
This type of dishonest health communication is why so many Americans don't trust public health officials. Don't pretend that the CDC is stating that vaccinated children should wear masks to bolster your guidelines. Just state honestly that California has a different policy.,masking and distancing,"vaccination,masking and distancing","vaccination,masking and distancing","vaccination,masking and distancing"
"Mmmm, no, it does not.  The CDC’s guidelines clearly state that it can be varied by location as needed.  So, you lied just then.  https://t.co/CliBQY4jcJ","masking and distancing,lockdowns",,"vaccination,masking and distancing",
This #holocaust survivor just compared your #mandatoryvaccination agenda to #Nazi ideology… https://t.co/65klmlCUdd,,vaccination,vaccination,vaccination
"Do they want reoutbreak of Covid19 in the ships?? No it won't. At least, they need to follow the CDC guidelines.","masking and distancing,lockdowns",,,
"💰Bill Gates on Track to Grow His Fortune Through Foundation’s Ties to Vaccine Makers • 
#COVID19 #Vaccines… https://t.co/tnJ5qNEsoc",vaccination,vaccination,vaccination,vaccination
"What about our Protection under #ADA.  Phuck #PROP &amp; #CDC ""Guidelines.""  #ADA review from 2020: Our right to pain medications is the #LAW  https://t.co/iyxHeDsDHr",,,,
Latest #CovidVaccine update. started last stage trials for an antibody medicine against #COVID__19 wit… https://t.co/teU0bccxQZ,vaccination,vaccination,vaccination,vaccination
"People who are fully vaccinated can travel within the U.S., according to updated CDC guidelines announced on Friday.  https://t.co/gcSa5MhcS2 02",vaccination,vaccination,vaccination,vaccination
A federal appeals court panel sided with the CDC in its legal battle with Florida over COVID-19 guidelines for cruise lines.    https://t.co/gmPv4PSR8z,"masking and distancing,lockdowns",,lockdowns,
#CovidVaccine I Trump forced vaccine in Oct. timeframe th… https://t.co/CViUzCkIAi,vaccination,vaccination,vaccination,vaccination
Is it a bad time to remind everyone that “I Am Legend” happened because a pharma company rushed out a vaccine. So… https://t.co/Bwz8H8MLGG,vaccination,vaccination,vaccination,vaccination
"My PMD told me in 2018 that DEA agent told him that ""they didn't care who suffers or who commits suicide they are going to get these drugs off the streets"". He also told me that the Direction for enforcing CDC guidelines came from Rick Scott who was Governor of FL at that time.",,,,
Masks are very effective ( https://t.co/9lyIaxtrOV) and help slow infection rates.  The CDC's guidelines state that ppl fully vaxxed don't need to wear a mask (but this may change if delta becomes more prevalent).   How many ppl do you think have died directly from the vaccine?,masking and distancing,"vaccination,masking and distancing","vaccination,masking and distancing","vaccination,masking and distancing"
CDC releases updated guidelines for schools amid fall return,masking and distancing,lockdowns,,
Moderna +8% on $1.5B vaccine supply agreement with U.S. government for initial 100M doses of mRNA-1273… https://t.co/mMpm2DxiVj,vaccination,vaccination,vaccination,vaccination
"CDC just held a public meeting going over the Opioid Workgroup's report on the 2022 drafyt Prescribing Guidelines, a revision to the 2016 one. Here's pointing out the massive degree of conflicts of interest in the lead author, Roger Chou.  https://t.co/k398v8FqPs",,,,
"[Flash Of News] Russia offers to help US with Covid 19 vaccine; US says no https://t.co/wKKyJ6uImH qua 

L… https://t.co/DWnCA71T3r",vaccination,vaccination,vaccination,vaccination
": BBT-68

Duniya ka pehla COVID Vaccine ,
Pehla shot to the daughter of Putin!!

#CovidVaccine 
#Russia
#hope 
#VladimirPutin

😊😊",vaccination,vaccination,vaccination,vaccination
I don't understand how schools can make a decision that goes against the CDC recommendations of all unvaccinated people wearing a mask. Is there another school district nearby that you can send your kids to- one that has Covid guidelines that you are more comfortable with?,"vaccination,masking and distancing","vaccination,masking and distancing",masking and distancing,"vaccination,masking and distancing"
An experimental vaccine developed by China's #Sinovac Biotech appeared to be safe in providing protection against t… https://t.co/pYnMaQ9szB,vaccination,vaccination,vaccination,vaccination
CDC Updates Guidelines To Protect Kids From COVID In School.    https://t.co/AVyiTbAJtd,"masking and distancing,lockdowns",lockdowns,"vaccination,masking and distancing",
"When you ask a politician about pot, they'll tell you, more research is needed.    ""...here.."" 💉  poke her face #CovidVaccine",vaccination,vaccination,vaccination,
"With its first shot given to Vladimir Putin's daughter— Russia, is now all set to unveil the Corona vaccine. #CovidVaccine",vaccination,vaccination,vaccination,vaccination
I must have missed CDC Guidelines that said you can go mask less on an airplane! According to the FFA You still needed to wear one. What makes you so special?  https://t.co/5uYtreRQXT,masking and distancing,masking and distancing,masking and distancing,masking and distancing
Trust a #Russian #CovidVaccine? https://t.co/aneX6foo1D,vaccination,vaccination,vaccination,vaccination
"Will the:
Rich
Movie Stars
Singers
and Select Religions
Still be immune to these rules?
#CovidVaccine","vaccination,masking and distancing,lockdowns",vaccination,,
"Doctor, #Logic failed. #State parties can't promise considering work towards this… https://t.co/20M8JVcSRL",,,,
"I was driving today when I heard thebnew CDC guidelines about children getting back to school - without masks and HEPA filters etc., because hey, they probably wont die. 🤬🤬🤬 what about LC? What about their families? I am SO angry. Death isnt the only metric!","masking and distancing,lockdowns",lockdowns,"masking and distancing,lockdowns",masking and distancing
"I agree but for me I’m more interested in the government officials &amp; Congress since they are implementing policies against us…I want to know what medications they are on, what it is for &amp; are they following the cdc guidelines just like us including UAs",masking and distancing,,,
"If ANTIFA just means Anti-Fascism, than why did President Biden condemn them?",,,,
"BREAKING: The CDC says in-person learning for students this fall “is a priority.”  *New guidelines state vaccinated teachers, staff, &amp; students don’t need to wear masks inside school buildings.  *Unvaxxed should still mask/socially distance in classroom.  https://t.co/Yj39ednE1w","vaccination,masking and distancing,lockdowns","vaccination,masking and distancing,lockdowns",masking and distancing,"vaccination,masking and distancing"
Yes.  I did.  It said specifically that the extra hour was only for local elections,,,,
"As of 12:01 a.m. Monday, masks will no longer be required in Pennsylvania except in certain situations outlined in CDC guidelines.  https://t.co/KEB2HjUpRI",masking and distancing,masking and distancing,masking and distancing,masking and distancing
"A3: Some schools such as are not creating their own policies but are following CDC guidelines, a safe and effective course of action. #IntlEdNOW","masking and distancing,lockdowns",,,
"Hey , you want the silent majority outside of #nova to rise up in #Virginia ? Let your health #czar… https://t.co/OSUmxiQEtw",,,,
While I'd trust Russia over china anyday. However they should have conducted phase 3 clinical trail… https://t.co/GqFkBESJRd,vaccination,vaccination,vaccination,vaccination
"Who is the Best PM-

#RussianVaccine
#Russian #CovidVaccine #coronavirus",vaccination,vaccination,,
CDC guidelines doesn't recognize AstraZeneca/Moderna mix as being fully vaccinated. All cruise ships are not allowing Canadians to sail who had mixed doses. So glad we listened to JT.  You wonder why there's vaccine hesitancy?,"vaccination,lockdowns",vaccination,vaccination,vaccination
Oxford University Covid vaccine trial put on hold due to adverse reaction in participant #CovidVaccine https://t.co/BxEpEtSfYK,vaccination,vaccination,vaccination,vaccination
Next step is ✨not✨ to take the first or even second rounds of the new #covidvaccine just wait a little until you do https://t.co/yrzfk2z78V,vaccination,vaccination,,vaccination
"Lingo Ink Presents ""Open Mindz"" Health &amp; Wellness VS Vaccines Episode https://t.co/DBYgEAVQeZ via #health… https://t.co/n0TBy2xVIJ",,vaccination,vaccination,vaccination
Vaccine Watch: Pfizer’s internal COVID-19 vaccine trial report finds no major safety issue. Check details ⤵️… https://t.co/sSaGqs9NQm,vaccination,vaccination,vaccination,vaccination
"Apparently, I'm not the only one worried that #Trump will trade America's health for his own needs by politicizing… https://t.co/XIXdeUdOMv",,,,
"We had an amazing virtual discussion last Friday with Sigma Xi fellow and virologist,  Dr. Mark Peeples. 

Here is… https://t.co/7tURGDpQCh",,lockdowns,vaccination,
KLL:ASX could become a 10 bagger stock by end of 2021. Production 2021. #stockstowatch #stockstobuy… https://t.co/rbDKT6DLNl,,,,
We’re at war with #COVID19. Other countries are beginning to embrace third/booster shots. But the has issued negligent advice in an apparent attempt to cover up for ill-advised guidelines and to preserve what is left of summer. Make no mistake about our “leaders”.,vaccination,vaccination,,vaccination
"Leave Fauci alone. Talk about Trump and Pence, who were in charge, CDC guidelines approved  by Administration.   Your constituents elected you to govern, not to create a "" witch hunt."" #DoYourJob",,,,
So it has only taken less than 2 months for countries/operators to reject people vaxxed with different makes.  The big cruise lines are following CDC guidelines and banning mixed vaxxed people .  Did no one in our govt foresee this?  ,vaccination,vaccination,masking and distancing,vaccination
"Who are these people!!😂😂 
 #toi #covid19 #vaccine #covidvaccine #trending #googlesearch https://t.co/mZSXrm2XUA",vaccination,vaccination,,
"The Moderna booster is very strong. If you had a first shot Pfizer, I'd stick with that. The CDC guidelines state as much.  Canada is just doing what is politically expedient and not what's in the best interest of the patient.",vaccination,vaccination,,vaccination
This is why they don't want kids in schools yet. This is why need false-positive COVID19 numbers. Te… https://t.co/p4IwGDMCJg,lockdowns,lockdowns,,
"Are you looking for a Logo Design for your brand?
You are in the right place, our DesignMasterTeam would love to wo… https://t.co/DPuXde4lfH",,,,
"NYS OTDA and an aide to Cuomo tell me NYC doesn’t need state approval to move people back into shelters bc the governor lifted social distancing guidelines yesterday. Only rule is that people in shelters have to wear masks per CDC guidance, they say","masking and distancing,lockdowns",masking and distancing,masking and distancing,masking and distancing
"Asking people why they wear their masks outside, against CDC guidelines.  https://t.co/qS24VQdlgB via ",masking and distancing,masking and distancing,masking and distancing,masking and distancing
"Media slams Sputnik V but stays silent as Western pharma chases approval for its jabs

#CovidVaccine #SputnikV https://t.co/wX2ysZyQm4",vaccination,vaccination,vaccination,vaccination
"In an important development, Serum Institute of India (SII) has started phase two and three clinical trials of its… https://t.co/LxaOXiY7b1",vaccination,vaccination,vaccination,vaccination
Organizations like mine follow CDC guidelines &amp; make no efforts beyond what is EXPLICITLY stated as public health regulations. There's been no HVAC improvement. There will be no masking there w/o a mandate. The onus is on our federal and state institutions to protect the public.,masking and distancing,masking and distancing,masking and distancing,
"You have moral responsibility to guide people in the right path.  If you can’t, that’s fine.! Just shut up and not contradict at experts and cdc guidelines. Sneering at experts  need to stop by right wing media.  Bear in mind, You are playing with people’s lives.",masking and distancing,,vaccination,
My opinion is the director of the CDC should be jailed for mass murder after issuing public health guidelines for the purpose of driving down worker wages.,masking and distancing,,,
"#Russia today recommended its #CovidVaccine Sputnik V for 18 to 60 year old persons. However, Russian scientist Ale… https://t.co/7kwWypHCmX",vaccination,vaccination,vaccination,vaccination
"Our treatment centers continue to follow strict CDC operational guidelines and we encourage all new patients to bring their own reusable masks - gaiters, bandanas &amp; face masks w/valves are not permitted. Your new life is dawning at Hope House!  https://t.co/Kz2dSHGbXc",masking and distancing,masking and distancing,masking and distancing,masking and distancing
"Educators’ unions appreciate the guidelines for CDC schools, but acknowledge the challenges  https://t.co/hUvgduntvD","masking and distancing,lockdowns",,,
"CDC relaxes guidelines, says vaccinated teachers and students don't need to wear masks in schools  https://t.co/4QjgTxVMT7","masking and distancing,lockdowns","vaccination,masking and distancing","vaccination,masking and distancing","vaccination,masking and distancing"
thanks for your work! i had allergic reaction to new shingles vaccine shot no. 1. an… https://t.co/mFchzxq03Z,vaccination,vaccination,vaccination,vaccination
girl i know from my old school went out without a mask even though she was fully vaccinated 🤨🤨 idc what the cdc guidelines are but that just sounds really weird to me,masking and distancing,"vaccination,masking and distancing","vaccination,masking and distancing",masking and distancing
"States - Health belong to us &amp; you can’t tell us what to do because freedum  CDC - We’ve given you vaccines, guidelines, PPE, &amp; metric assloads of $$$… States- We’re dying! CDC - See above &amp; tell your citizens to stop being dumb","vaccination,masking and distancing",vaccination,vaccination,"vaccination,masking and distancing"
The CDC has issued guidelines for post-vaccination activities  https://t.co/EQx6oAyQ2I via ,"masking and distancing,lockdowns",vaccination,vaccination,vaccination
"Coronavirus catches up with Usain Bolt, world's fastest man 
#Covid19Millionaires #CovidVaccine #covid https://t.co/D4FCPahiDb",vaccination,vaccination,,
"Moscow Mayor Sobyanin was vaccinated by the Russian anti #COVIDー19 vaccine #SputnikV. That is the same vaccine, fro… https://t.co/rWH9N3Vs9n",vaccination,vaccination,vaccination,vaccination
Kids aren’t vaccinated so that is CDC medical  guidelines actually that’s what the CDC DOES recommend,"vaccination,masking and distancing",vaccination,vaccination,vaccination
"This would not be a story if it was a single county and that was the end. The reporting guidelines are from the CDC. Their own death count lists deaths only as ""involving"" Covid. Not from. Not caused by.",masking and distancing,,,
And they are calling it “Sputnik” 🤗 after the spacecraft that took space dog Laika up past the clouds when I was 6… https://t.co/jEDJTGXI1L,vaccination,,vaccination,
"she says she is not anti-vax, just covid19 vax. More attention grabbing I fear. On the bandwagon and… https://t.co/GN0i2TqNsO",vaccination,vaccination,,vaccination
"Age Does Not Contribute To COVID-19 Susceptibility Study Suggests 
 
#COVID19 #age #study… https://t.co/l2QN54rZZZ",vaccination,,,
"Ordinary Chinese residents could start receiving #CovidVaccine as early as November, according to Wu Guizhen, the c… https://t.co/Rfk04Y5qLs",vaccination,vaccination,vaccination,vaccination
"This is why they don't want kids in schools yet. If you make the flu vaccine mandatory, FOREVER #CovidVaccine… https://t.co/S8ifX0ivNP","vaccination,lockdowns","vaccination,lockdowns",vaccination,vaccination
Message: Return pain medicine access back to chronic pain patients and stop arresting doctors who treat us. We advocate the reversal of The War On Drugs  &amp;  2016 CDC Guidelines; under a false flag. They're hurting so many! Ppl are turning to illicit drugs in desperation.  https://t.co/sbvYFxjb9T,,,,
"Russian President Vladimir Putin launched a #coronavirus vaccine. 

#COVID19 #RussianVaccine… https://t.co/Qrv37Euurb",vaccination,vaccination,vaccination,vaccination
"Compulsory vaccines for children, and no liability for manufacturers""!""! https://t.co/V7jNZ4YThw via https://t.co/XtSfnWyTPX",vaccination,vaccination,vaccination,vaccination
This Tory MP you’re chatting to just stated ‘I hope it’s a British company’ that comes up with the first… https://t.co/Ow43qiqcVx,,,vaccination,
"I'm not understanding the ""new"" CDC school guidelines. Kids don't need masks to protect them from covid since it's so low risk to them. Are the masks to protect vaccinated teachers? Isnt that what the...vaccine is for?? Masks are not normal. Kids need normal. #UNMASKOURCHILDREN","vaccination,masking and distancing","vaccination,masking and distancing","vaccination,masking and distancing","vaccination,masking and distancing"
"OPINION | Why 'Sputnik moment' of Russia's first #COVIDVaccine triggered 'sour grapes' reaction in Western MSM

https://t.co/NFLLsJDPwO",vaccination,vaccination,vaccination,vaccination
President Rodrigo Duterte on Monday said he is “very happy” by the news that #Russia would provide vaccines free of… https://t.co/VitruCjLuG,vaccination,vaccination,vaccination,vaccination
Same thing happened with the mask guidelines back in may if I remember correctly. Then one day Biden eased the guidelines and the CDC followed suit.,masking and distancing,masking and distancing,masking and distancing,masking and distancing
#DeBlasio to Keep #MaskMandate in Schools Enforced Despite #CDC New Guidelines:  https://t.co/9IYA0DjDMo,"masking and distancing,lockdowns",,,masking and distancing
ETHealthworld | Brazil's Bolsonaro rejects coronavirus vaccine from China #CovidVaccine #Brazil #China #Coronavirus… https://t.co/uFdg9j2LOT,vaccination,vaccination,vaccination,vaccination
"Around this time, the CDC's guidelines said the same. You've been making strawman points recently.","masking and distancing,lockdowns",,,
Realistically no #CovidVaccine before April 2021. Let's face it. The world needs to wait more 6 months #CoronavirusOutbreak,vaccination,vaccination,vaccination,vaccination
CDC guidelines still apply to private jets. Unless you believe the wealthy to have special guidelines?,masking and distancing,,,
"Dear Please let us know if California Governor will be included in this fascist censorship campaign, since he has us going against CDC guidelines?",lockdowns,,,
imagine if cancer closed the world economies how fast we would have a cure it boggles the mind we can have a potent… https://t.co/OE1X23cxRn,,,vaccination,
UK vaccines receive a green signal after being put on hold. Here’s a rundown of what happened this past week.… https://t.co/lXjZpBhef7,vaccination,vaccination,vaccination,vaccination
"We have to get rid of the CDC Guidelines. Not revise them, eliminate them. Go back to the way things were before illicit fentanyl. Give us our meds and let God sort it out. Those who abuse, die. The rest of us will get back our QOL back. #opioidhysteria #illicitfentanylcrisis",masking and distancing,,,
Good to see Kate Bingham -  responsible for buying the UK #CovidVaccine stockpile - helping to test one of them out… https://t.co/uJY2OgG0Br,vaccination,vaccination,vaccination,vaccination
